{
  "decision_question": "大一 C 语言课程是否应该允许学生使用生成式 AI 编程助手？",
  "target_population": "university first-year computer science students learning C programming for the first time",
  "target_context": "16-week lecture-lab course, 60 students, TA support, offline",
  "supported_claims": [
    "AI coding assistants reliably increase task performance during training (completion speed, correctness) — E-001, E-006.",
    "Unguarded generative AI access can harm independent problem solving when access is removed — E-004.",
    "Guardrail design (hints instead of answers) substantially mitigates the negative learning effect — E-005.",
    "Task performance gains do not automatically imply learning gains — E-004 vs E-006 (within-study contrast)."
  ],
  "uncertain_claims": [
    "Whether AI coding assistants improve or preserve actual programming learning in university novices — no direct university-level study in reviewed set.",
    "Whether one-week neutral retention (Kazemitabaar 2023) extends to a semester — E-003."
  ],
  "contradicted_claims": [
    "The claim 'AI tools always improve learning' is contradicted by E-004 (unguarded access, -17% independent exam)."
  ],
  "reason_for_disagreement": "Disagreement comes from outcome separation (task vs learning), tool design (guarded vs unguarded), and population (K-12 vs university). Studies measuring task performance show positive effects; the only study measuring independent learning after removal of AI shows harm without guardrails.",
  "methodology_summary": "Two RCTs (one small K-12, one large high-school math) plus one mixed-methods undergraduate writing study. No direct RCT in university programming courses. All strong on internal validity; directness to the target context is weak.",
  "outcome_specific_findings": {
    "completion_time": "positive (E-001)",
    "independent_problem_solving": "neutral-to-negative without guardrails (E-002, E-004)",
    "retention": "neutral over 1 week (E-003)",
    "assignment_score": "positive during practice, negative on closed-book exam (E-004, E-006)",
    "ai_dependency": "documented crutch behavior with unguarded tool (E-004, E-005)"
  },
  "short_term_effect": "Task performance reliably increases; learning effect null-to-negative without guardrails.",
  "long_term_effect": "No evidence beyond one week; long-term learning effect unknown.",
  "transfer_effect": "No full transfer evidence; manual code-modification not harmed in one small study (E-002).",
  "risk_effect": "AI dependency and over-reliance risk is real and documented for unguarded usage (E-004).",
  "applicability": {
    "suitable_for": "pilot in first-year C course with guardrailed usage policy",
    "not_suitable_for": "unrestricted AI adoption without usage policy",
    "required_conditions": [
      "guardrailed AI usage policy",
      "no-AI transfer assessment",
      "TA support"
    ]
  },
  "confidence": "Moderate",
  "confidence_breakdown": {
    "score": 0.559,
    "evidence_quality": 0.786,
    "consistency": 0.8,
    "directness": 0.429,
    "evidence_count": 7,
    "independent_studies": 3,
    "independent_samples": 3,
    "count_term": 0.75,
    "conflict_penalty": 0.15,
    "unsupported_penalty": 0.0
  },
  "what_can_be_claimed": [
    "AI coding assistants raise task performance for novices during training.",
    "Unguarded access carries a real risk of hurting independent problem solving.",
    "Guardrail design can mitigate that risk.",
    "Direct evidence for university C programming learning is missing."
  ],
  "what_cannot_be_claimed": [
    "AI coding assistants improve (or even preserve) university students' programming learning.",
    "Any long-term or retention benefit.",
    "Any claim about which students benefit, based on university samples."
  ],
  "missing_evidence": [
    "RCT of AI coding assistants in university programming courses with retention and no-AI transfer tests.",
    "Studies varying AI usage policy within the same course.",
    "Longitudinal data on AI dependency beyond one course."
  ],
  "recommended_action": "pilot",
  "decision_rationale": "Positive task-performance evidence plus documented unguarded-access risk and missing university-level learning evidence → bounded, guardrailed pilot with evaluation, not full adoption.",
  "exceeds_evidence_boundary": [
    "'AI 编程助手提高学习效果' — exceeds: direct learning-effect evidence is missing.",
    "'AI 对所有人有效' — exceeds: population and subject mismatch."
  ],
  "confidence_score": 0.559,
  "confidence_policy_version": "2026-08-12.v1",
  "independent_studies": 3,
  "independent_samples": 3,
  "raw_model_confidence": "Moderate",
  "raw_model_confidence_breakdown": {
    "score": 0.603,
    "evidence_quality": 0.829,
    "consistency": 0.8,
    "directness": 0.429,
    "evidence_count": 7,
    "count_term": 0.875,
    "conflict_penalty": 0.15,
    "unsupported_penalty": 0.0
  }
}
