{
  "decision_question": "Should an enterprise customer-support team introduce a generative AI assistant?",
  "target_population": "Enterprise customer-support staff, stratified by tenure and baseline skill.",
  "target_context": "Human-supervised support using an approved knowledge base.",
  "recommended_action": "pilot",
  "confidence": "Moderate",
  "confidence_score": 0.578,
  "confidence_policy_version": "2026-08-12.v3",
  "raw_model_confidence": "Moderate",
  "raw_model_confidence_breakdown": {},
  "independent_studies": 3,
  "independent_samples": 3,
  "supported_claims": [
    "AI assistance can shorten customer chat handling in a bounded support setting; throughput is a separate outcome. — E-001",
    "ChatGPT reduced time on short professional writing tasks; this is indirect evidence for customer support. — E-002",
    "AI can reduce correctness on tasks outside its capability frontier; consulting evidence is indirect for support. — E-003",
    "Experienced, high-skill support staff need separate quality monitoring rather than assumed uniform benefits. — E-004"
  ],
  "uncertain_claims": [
    "Local net cost, privacy incident rates, subgroup service quality and sustained performance are not established by this selected evidence set [no direct evidence]."
  ],
  "decision_rationale": "A supervised pilot is warranted because one direct field study supports efficiency gains but also reveals heterogeneous quality effects. Indirect experiments identify task boundaries, while local safety and net value remain unknown.",
  "strongest_support": "Supervised AI assistance improves handling speed and answer consistency in customer-support work, with quality maintained.",
  "key_uncertainty": "Evidence comes from adjacent writing and advisory settings rather than the support floor, so transfer to live customer conversations is unproven.",
  "main_risk": "Unsupervised or knowledge-base-free use can produce confident wrong answers to customers, and over-reliance erodes agent skill over time.",
  "next_action": "Run a supervised pilot on approved knowledge bases with human review on every reply, and track escalation and correction rates.",
  "methodology_summary": "One staggered-rollout quasi-experiment and two randomized experiments. Only the support study is direct; no pooled standardized effect or model benchmark was computed.",
  "what_can_be_claimed": [
    "Under human supervision on an approved knowledge base, AI assistance can shorten handling time while quality is monitored.",
    "Benefits are not uniform across staff: the most experienced agents need their own quality monitoring."
  ],
  "what_cannot_be_claimed": [
    "Universal gains, autonomous deployment safety, privacy protection, reduced staffing requirements or educational learning gains."
  ],
  "exceeds_evidence_boundary": [
    "Claiming universal gains or that autonomous deployment is safe exceeds the boundary: no included study measures privacy incidents, local net cost or subgroup service quality."
  ],
  "missing_evidence": [
    "Local net cost, privacy incident rates, subgroup service quality and sustained performance are not established by this selected evidence set [no direct evidence]."
  ],
  "applicability": {
    "required_conditions": [
      "Start with low-risk, knowledge-base-covered queues; agents inspect and edit every proposed reply.",
      "Stratify by tenure and baseline skill; retain expert discretion and measure review workload.",
      "Minimize and redact customer data, restrict access and retention, and review supplier data-use terms before a pilot.",
      "Escalate unfamiliar, ambiguous, sensitive or high-stakes requests to qualified humans; no autonomous commitments."
    ]
  },
  "extensions": {
    "data_origin": "manual_curated",
    "benchmark_eligible": false,
    "note": "Confidence and the decision bound come from the deterministic policy in engine/decision_policy.py, enforced by the Pre-Verdict Gate; this record is a curated evidence selection, not a systematic review or a model run.",
    "knowledge_gaps": [
      {
        "gap_id": "G-001",
        "evidence_ids": [
          "E-001",
          "E-002",
          "E-003",
          "E-004"
        ],
        "summary": "Local net cost, privacy incident rates, subgroup service quality and sustained performance are not established by this selected evidence set [no direct evidence]."
      }
    ]
  },
  "confidence_breakdown": {
    "score": 0.578,
    "evidence_quality": 0.8,
    "consistency": 0.0,
    "directness": 0.75,
    "evidence_count": 4,
    "independent_studies": 3,
    "independent_samples": 3,
    "count_term": 0.75,
    "conflict_penalty": 0.0,
    "unsupported_penalty": 0.0
  }
}
